_id,classe,spell,pa,pm,wakfu,po,text,spell_type,sprite
5f04a9562b523147dc2fe107,pandawa,Éméché,0,0,0,false,"Un Pandawa sachant porter son Tonneau est un bon Pandawa. C'est pourquoi, avec ce passif, il gagne en robustesse quand il porte son Tonneau.",spécialité,https://static.ankama.com/wakfu/portal/game/spell/2215.png
5f04a9632b523147dc2fe108,roublard,Mitraille,3,0,0,1 - 3,"Tout en s'éloignant, le Roublard assène un bon coup de Mitraille dans les entrailles des fous qui seraient dans sa ligne de mire.",élementaire,https://static.ankama.com/wakfu/portal/game/spell/1807.png
5f04a9652b523147dc2fe109,roublard,Barbrûlé,3,0,0,3 - 5,"Le Roublard se sert d’un barbelé magique comme d’un fouet pour voler de la vie à un adversaire, ou soigner et renforcer une de ses bombes.",élementaire,https://static.ankama.com/wakfu/portal/game/spell/1800.png
5f04a9672b523147dc2fe10a,roublard,Bombe Aveuglante,4,0,0,1 - 6,"Pose une bombe sur le terrain qui va en mettre plein la vue à vos adversaires ! Lors de son explosion, elle inflige des dommages et retire de la portée.",élementaire,https://static.ankama.com/wakfu/portal/game/spell/2336.png
5f04a9692b523147dc2fe10b,roublard,Exécution,2,0,0,1 - 4,"Les dommages de ce tir augmentent à chaque pose de bombe, pour une bonne exécution dans les règles de l'art.",élementaire,https://static.ankama.com/wakfu/portal/game/spell/6465.png
5f04a96a2b523147dc2fe10c,roublard,Tir Croisé,3,0,0,4 - 10,"Ce tir ne se lance qu'en diagonale mais à très longue portée. Il a pour objectif d’atteindre des cibles placées dans des angles morts pour en faire des cibles mortes.
Les bombes alignées avec la cible sont attirées vers le point d'impact.",élementaire,https://static.ankama.com/wakfu/portal/game/spell/6466.png
5f04a96c2b523147dc2fe10d,roublard,Tir Perforant,6,0,true,2 - 5,"Ce tir permet au Roublard de briser l'armure de sa cible puis d'infliger des dommages colossaux si le Roublard a beaucoup de points de Wakfu. Un sort très précieux contre, entre autres, ces petits malins de Fécas.",élementaire,https://static.ankama.com/wakfu/portal/game/spell/6467.png
5f04a96e2b523147dc2fe10e,roublard,Tromblon,4,0,0,1 - 2,"« Blam !!! Voilà certainement le dernier son qu’entendront les crétins qui se mettront en travers de ma route ». 
- Remington Smisse",élementaire,https://static.ankama.com/wakfu/portal/game/spell/2337.png
5f04a9702b523147dc2fe10f,roublard,Bombe Paralysante,3,0,0,1 - 6,"Pose une bombe sur le terrain qui paralysera vos adversaires de terreur ! Lors de son explosion, elle inflige des dommages et retire des points de mouvement.",élementaire,https://static.ankama.com/wakfu/portal/game/spell/6470.png
5f04a9722b523147dc2fe110,roublard,Dague Boomerang,4,0,0,2 - 3,"Le Roublard se sert de sa dague comme d'un boomerang qu'il projette sur ses adversaires. En coup critique, il ajoute un tir supplémentaire, infligeant bien plus de dommages qu'un coup critique classique.",élementaire,https://static.ankama.com/wakfu/portal/game/spell/6471.png
5f04a9732b523147dc2fe111,roublard,Pulsar,2,0,true,1 - 3,"Le Roublard utilise tous ses PM restants pour rendre son tir dévastateur. Lancé en début de tour, les dommages de Pulsar sont doublés mais il ne peut être relancé que dans 2 tours.",élementaire,https://static.ankama.com/wakfu/portal/game/spell/1804.png
5f04a9752b523147dc2fe112,roublard,Coup Rapide,2,0,0,1 - 1,"« Il vaut mieux un petit coup rapide bien placé qu’un gros coup à côté. »
- Katsumimi la Roublarde",élementaire,https://static.ankama.com/wakfu/portal/game/spell/1811.png
5f04a9782b523147dc2fe113,roublard,Entre Côtes,3,0,0,1 - 1,Entre Côtes permet au Roublard de porter un coup saignant et bien placé qui sera certainement au goût de sa victime.,élementaire,https://static.ankama.com/wakfu/portal/game/spell/2331.png
5f04a97b2b523147dc2fe114,roublard,Grappin,2,0,0,1 - 3,"« Grappin c’est mon meilleur coup de poing, point barre ! »
- Le garçon de l’enfer",élementaire,https://static.ankama.com/wakfu/portal/game/spell/6475.png
5f04a97c2b523147dc2fe115,roublard,Bombe Asphyxiante,2,0,0,1 - 6,"Pose une bombe sur le terrain qui ne laissera pas souffler vos adversaires. Lors de son explosion, elle inflige des dommages et retire temporairement des points de Wakfu.",élementaire,https://static.ankama.com/wakfu/portal/game/spell/6476.png
5f04a97e2b523147dc2fe116,roublard,Evanescence,2,0,true,1 - 4,"Subtil comme un renard, le Roublard disparaît dans les ombres pour réapparaître un peu plus loin et enchaîner sur un coup bien placé.",élementaire,https://static.ankama.com/wakfu/portal/game/spell/1810.png
5f04a97e2b523147dc2fe117,roublard,Ruse,2,0,true,1 - 4,"Subtil comme un renard, le Roublard disparaît dans les ombres pour réapparaître un peu plus loin et enchaîner sur un coup bien placé.",spécialité,https://static.ankama.com/wakfu/portal/game/spell/6489.png
5f04a97e2b523147dc2fe118,roublard,Botte,2,0,0,1 - 6,"Le Roublard attrape la bombe la plus proche de lui, dans la même ligne ou diagonale, pour la déplacer sur la case ciblée. Il profite ensuite d'une Connexion qui lui octroie 2 PM seulement si sa prochaine action est un déplacement.",spécialité,https://static.ankama.com/wakfu/portal/game/spell/1817.png
5f04a97f2b523147dc2fe119,roublard,Mur de Poudre,2,0,0,1 - 6,"Le Roublard attrape la bombe la plus proche de lui, dans la même ligne ou diagonale, pour la déplacer sur la case ciblée. Il profite ensuite d'une Connexion qui lui octroie 2 PM seulement si sa prochaine action est un déplacement.",spécialité,https://static.ankama.com/wakfu/portal/game/spell/6491.png
5f04a97f2b523147dc2fe11a,roublard,Roublabot,2,0,true,1 - 4,"Entre toutes les bombes sur le terrain se forme un mur de poudre qui infligera d'énormes dommages à quiconque aura le malheur de commencer son tour dessus.",spécialité,https://static.ankama.com/wakfu/portal/game/spell/1819.png
5f04a97f2b523147dc2fe11b,roublard,Dynamite,2,0,true,1 - 4,"Entre toutes les bombes sur le terrain se forme un mur de poudre qui infligera d'énormes dommages à quiconque aura le malheur de commencer son tour dessus.",spécialité,https://static.ankama.com/wakfu/portal/game/spell/6493.png
5f04a9802b523147dc2fe11c,roublard,Fumigènes,0,0,true,1 - 4,"Attention, tout va sauter, planquez-vous !!",spécialité,https://static.ankama.com/wakfu/portal/game/spell/1823.png
5f04a9802b523147dc2fe11d,roublard,Roublaboom,0,0,true,1 - 4,"Attention, tout va sauter, planquez-vous !!",spécialité,https://static.ankama.com/wakfu/portal/game/spell/5357.png
5f04a9802b523147dc2fe11e,roublard,Gadgets évolués,0,0,0,false,"Permet au Roublard d'avoir plus de bombes et Roublabot sur le terrain et renforce l'outil précieux qu'est le Roublabot.",spécialité,https://static.ankama.com/wakfu/portal/game/spell/6480.png
5f04a9802b523147dc2fe11f,roublard,Bomber Fan,0,0,0,false,"Permet au Roublard d'avoir plus de bombes et Roublabot sur le terrain et renforce l'outil précieux qu'est le Roublabot.",spécialité,https://static.ankama.com/wakfu/portal/game/spell/4311.png
5f04a9812b523147dc2fe120,roublard,Artificier,0,0,0,false,"Augmente les combos que les bombes obtiennent naturellement par tour et le maximum de combo qu'elles peuvent posséder.",spécialité,https://static.ankama.com/wakfu/portal/game/spell/6482.png
5f04a9812b523147dc2fe121,roublard,Tunique renforcée,0,0,0,false,"Augmente les combos que les bombes obtiennent naturellement par tour et le maximum de combo qu'elles peuvent posséder.",spécialité,https://static.ankama.com/wakfu/portal/game/spell/1816.png
5f04a9812b523147dc2fe122,roublard,Démineur,0,0,0,false,"Renforce la tunique et les armements du Roublard, augmentant ses points de vie et ceux de ses bombes.",spécialité,https://static.ankama.com/wakfu/portal/game/spell/2335.png
5f04a9812b523147dc2fe123,roublard,Lunette de visée,0,0,0,false,"Renforce la tunique et les armements du Roublard, augmentant ses points de vie et ceux de ses bombes.",spécialité,https://static.ankama.com/wakfu/portal/game/spell/2332.png
5f04a9822b523147dc2fe124,roublard,Maître Roublard,0,0,0,false,"Certains Roublards préfèrent tenir la distance, ayant déjà vécu des relations compliquées. Ce passif leur permet de gagner en portée et de miner le terrain de plus loin.",spécialité,https://static.ankama.com/wakfu/portal/game/spell/2339.png
5f04a9822b523147dc2fe125,roublard,K-Boom,0,0,0,false,"Certains Roublards préfèrent tenir la distance, ayant déjà vécu des relations compliquées. Ce passif leur permet de gagner en portée et de miner le terrain de plus loin.",spécialité,https://static.ankama.com/wakfu/portal/game/spell/6487.png
5f04a9822b523147dc2fe126,roublard,Fugitif,0,0,0,false,"« K-Boom » c'est le son d'une bombe qui explose mais aussi du cœur qui bat pour un allié en manque de dégâts. Un bon coup de boost afin de flanquer une bonne rouste !",spécialité,https://static.ankama.com/wakfu/portal/game/spell/2334.png
5f04a98a2b523147dc2fe127,zobal,Fugue,2,0,0,1 - 1,"Fugue permet au Zobal d’infliger des dommages puis de s’éloigner de sa cible. Fuir, oui, mais pas sans frapper.",élementaire,https://static.ankama.com/wakfu/portal/game/spell/3308.png
5f04a98d2b523147dc2fe128,zobal,Félure,3,0,0,1 - 1,"Un sort simple mais efficace, qui inflige des dégâts en zone.",élementaire,https://static.ankama.com/wakfu/portal/game/spell/3303.png
5f04a98f2b523147dc2fe129,zobal,Détraquage,4,0,0,false,"Quand le Zobal est cerné, il peut invoquer les cornes du masque du Psychopathe pour punir ceux se trouvant à côté de lui.",élementaire,https://static.ankama.com/wakfu/portal/game/spell/3304.png
5f04a9922b523147dc2fe12a,zobal,Psycotic,3,0,0,0 - 2,"Le Zobal déchaine un tourbillon de lames autour de lui, infligeant des dégâts et attirant les cibles dans les quatre directions.",élementaire,https://static.ankama.com/wakfu/portal/game/spell/3305.png
5f04a9952b523147dc2fe12b,zobal,Psycose,4,0,0,1 - 6,"Le Zobal plante ses cornes dans l’ennemi, puis tire dessus pour venir au contact.",élementaire,https://static.ankama.com/wakfu/portal/game/spell/3306.png
5f04a9982b523147dc2fe12c,zobal,Psycate,6,0,true,3 - 5,"Le Zobal saute à plusieurs cases de distance tout en faisant d'énormes dégâts sur son passage.",élementaire,https://static.ankama.com/wakfu/portal/game/spell/3307.png
5f04a9992b523147dc2fe12d,zobal,Zobi Zoba,4,0,0,1 - 3,"Pour prendre ses distances avec un ennemi, le mieux est encore de le repousser, et de prendre la fuite dans la direction inverse. Ce sort pousse dans la direction où regardait le Zobal avant de lancer le sort.",élementaire,https://static.ankama.com/wakfu/portal/game/spell/3309.png
5f04a99c2b523147dc2fe12e,zobal,Dard Agnan,3,0,0,1 - 5,"Dard Agnan permet de faire des dégâts en zone, ou de soigner et de donner de l'Esquive en zone, selon le Masque porté.",élementaire,https://static.ankama.com/wakfu/portal/game/spell/3310.png
5f04a99f2b523147dc2fe12f,zobal,Dard Fugace,4,0,0,0 - 4,"Dard Fugace permet d'échanger de position avec la cible, tout en lui faisant des dégâts si c'est un adversaire, et en la soignant si c'est un allié !",élementaire,https://static.ankama.com/wakfu/portal/game/spell/3311.png
5f04a9a22b523147dc2fe130,zobal,Dard Dare,5,0,true,1 - 3,"Sur un ennemi, le Zobal inflige des dégâts et peut infliger Chaînes si le Zobal est sous Libérateur. Sur un allié, il le soigne.",élementaire,https://static.ankama.com/wakfu/portal/game/spell/3312.png
5f04a9a62b523147dc2fe131,zobal,Coup de Pied Fouetté,3,0,0,1 - 1,"Un violent coup de pied direct simple mais efficace, très utile pour déstabiliser votre adversaire.",élementaire,https://static.ankama.com/wakfu/portal/game/spell/3314.png
5f04a9a72b523147dc2fe132,zobal,Dantine,0,2,0,1 - 1,"Dantine permet de faire reculer la cible, mais en la poursuivant pour qu’elle ne s’échappe pas.",élementaire,https://static.ankama.com/wakfu/portal/game/spell/3313.png
5f04a9a82b523147dc2fe133,zobal,Clasampa,2,0,0,1 - 3,Le Zobal tire la cible puis passe dans son dos.,élementaire,https://static.ankama.com/wakfu/portal/game/spell/3315.png
5f04a9ac2b523147dc2fe134,zobal,Claspontero,2,0,0,1 - 1,Claspontero permet de lier le Zobal à une cible. Il pourra ensuite la tirer avec lui !,élementaire,https://static.ankama.com/wakfu/portal/game/spell/3316.png
5f04a9ae2b523147dc2fe135,zobal,Clasmada,4,0,true,1 - 3,"Le Zobal effectue un saut vers son ennemi, et le repousse sous la force de son assaut.",élementaire,https://static.ankama.com/wakfu/portal/game/spell/3317.png
5f04a9ae2b523147dc2fe136,zobal,Masque du Pleutre,4,0,true,1 - 3,"Le Zobal effectue un saut vers son ennemi, et le repousse sous la force de son assaut.",spécialité,https://static.ankama.com/wakfu/portal/game/spell/3318.png
5f04a9af2b523147dc2fe137,zobal,Esprit Masqué,4,0,true,1 - 1,"Le pouvoir des masques permet d'invoquer un double de lui même. Attention cependant, le Zobal subira également les dégâts reçus par son Esprit Masqué.",spécialité,https://static.ankama.com/wakfu/portal/game/spell/3360.png
5f04a9af2b523147dc2fe138,zobal,Masque du Psychopathe,4,0,true,1 - 1,"Le pouvoir des masques permet d'invoquer un double de lui même. Attention cependant, le Zobal subira également les dégâts reçus par son Esprit Masqué.",spécialité,https://static.ankama.com/wakfu/portal/game/spell/3359.png
5f04a9af2b523147dc2fe139,zobal,Masque de la Classe,2,0,0,false,"Le masque du Psychopathe rend le Zobal fou. Il sombre dans la folie, et augmente ses dégâts au détriment de ses résistances.",spécialité,https://static.ankama.com/wakfu/portal/game/spell/3320.png
5f04a9af2b523147dc2fe13a,zobal,Danse Macabre,2,0,0,false,"Le masque du Psychopathe rend le Zobal fou. Il sombre dans la folie, et augmente ses dégâts au détriment de ses résistances.",spécialité,https://static.ankama.com/wakfu/portal/game/spell/3361.png
5f04a9af2b523147dc2fe13b,zobal,Libération de Wakfu,2,0,true,false,"Est-ce une danse ou un rituel ? Nul ne le sait. Toujours est-il que la Danse Macabre du Zobal lui permet d'augmenter sa mobilité, et même de ressusciter ses alliés en sacrifiant l'Esprit Masqué à leur cause.",spécialité,https://static.ankama.com/wakfu/portal/game/spell/3362.png
5f04a9b02b523147dc2fe13c,zobal,"Art de l'Esquive",2,0,true,false,"Est-ce une danse ou un rituel ? Nul ne le sait. Toujours est-il que la Danse Macabre du Zobal lui permet d'augmenter sa mobilité, et même de ressusciter ses alliés en sacrifiant l'Esprit Masqué à leur cause.",spécialité,https://static.ankama.com/wakfu/portal/game/spell/3363.png
5f04a9b02b523147dc2fe13d,zobal,Bas les Masques,0,0,0,false,Ce passif permet d’augmenter les dégâts et soins du Zobal en fonction de son esquive. L’arme parfaite du Zobal furtif qui aime fuir ou se déplacer parmi ses ennemis.,spécialité,https://static.ankama.com/wakfu/portal/game/spell/3364.png
5f04a9b02b523147dc2fe13e,zobal,Carnaval,0,0,0,false,"En enchainant esquives et coups normaux, le Zobal gagne du Renouvellement, qui une fois niveau 30 lui permettra de réduire ou d'augmenter les résistances de sa cible, en infligeant un coup critique dévastateur.",spécialité,https://static.ankama.com/wakfu/portal/game/spell/3357.png
5f04a9b02b523147dc2fe13f,zobal,Maîtrise Zobal,0,0,0,false,"En enchainant esquives et coups normaux, le Zobal gagne du Renouvellement, qui une fois niveau 30 lui permettra de réduire ou d'augmenter les résistances de sa cible, en infligeant un coup critique dévastateur.",spécialité,https://static.ankama.com/wakfu/portal/game/spell/3356.png
5f04a9b02b523147dc2fe140,zobal,Au Contact,0,0,0,false,"Un Maître Zobal domine le terrain et le façonne à sa façon. Il inflige de meilleurs dégâts lorsqu'il attaque ses cibles de dos, ainsi que lorsqu'il crée des collisions, tout en se soignant en le faisant.",spécialité,https://static.ankama.com/wakfu/portal/game/spell/5347.png
5f04a9b02b523147dc2fe141,zobal,Disciple des éléments,0,0,0,false,"Un Maître Zobal domine le terrain et le façonne à sa façon. Il inflige de meilleurs dégâts lorsqu'il attaque ses cibles de dos, ainsi que lorsqu'il crée des collisions, tout en se soignant en le faisant.",spécialité,https://static.ankama.com/wakfu/portal/game/spell/5348.png
5f04a9b12b523147dc2fe142,zobal,Zobal Classieux,0,0,0,false,"Grâce à ce passif, maîtriser à la perfection la puissance de trois éléments sera récompensé à sa juste valeur.",spécialité,https://static.ankama.com/wakfu/portal/game/spell/5359.png
5f04a9bc2b523147dc2fe143,ouginak,Plombage,3,0,true,1 - 1,Ce sort inflige de puissants dommages à ses adversaires en ligne.,élementaire,https://static.ankama.com/wakfu/portal/game/spell/6256.png
5f04a9bf2b523147dc2fe144,ouginak,Fléau,4,0,true,1 - 3,L’Ouginak crée un geyser sous ses cibles. Il récupère une partie de la vie qu’il leur retire et réduit l’efficacité des soins qu’elles reçoivent.,élementaire,https://static.ankama.com/wakfu/portal/game/spell/6257.png
5f04a9c22b523147dc2fe145,ouginak,Rupture,2,0,0,1 - 2,Les dégâts de ce sort s’accompagnent d’un puissant vol de vie. L’Ouginak peut bondir sur la case ciblée si elle est vide.,élementaire,https://static.ankama.com/wakfu/portal/game/spell/6258.png
5f04a9c42b523147dc2fe146,ouginak,Balafre,5,0,0,1 - 4,"En combattant accompli, l’Ouginak s’empare de ses dagues afin de les lancer sur ses adversaires ! Il récupère l'Armure de sa cible avant de la blesser.",élementaire,https://static.ankama.com/wakfu/portal/game/spell/6259.png
5f04a9c62b523147dc2fe147,ouginak,Emeute,4,0,0,1 - 2,"L’Ouginak utilise son fidèle Chienchien pour occasionner davantage de dommages ! Si l'Ouginak lance ce sort, alors le Chienchien l'exécute également en face de lui, à une distance équivalente.",élementaire,https://static.ankama.com/wakfu/portal/game/spell/6260.png
5f04a9c72b523147dc2fe148,ouginak,Saccade,4,0,0,1 - 2,"Ce sort de dégâts exploite les points faibles dans la défense de sa cible afin d’infliger des dommages qui passent outre l'Armure.",élementaire,https://static.ankama.com/wakfu/portal/game/spell/6264.png
5f04a9c82b523147dc2fe149,ouginak,Hachure,2,0,true,1 - 2,"Hachure fait des dommages conséquents sur la cible de l'Ouginak. Plus ce dernier possède de Rage, plus les dommages sont puissants.",élementaire,https://static.ankama.com/wakfu/portal/game/spell/6262.png
5f04a9c92b523147dc2fe14a,ouginak,Bastonnade,4,0,true,1 - 1,"L’Ouginak utilise ses dagues avec brutalité afin de blesser un ennemi. Il gagne de l’Armure en fonction de la Rage qu'il possède.",élementaire,https://static.ankama.com/wakfu/portal/game/spell/6263.png
5f04a9cb2b523147dc2fe14b,ouginak,Croc-en-jambe,2,0,0,false,"C’est un des grands classiques de l’Ouginak. Sa morsure paralyse sa cible, l’empêchant de s’enfuir.",élementaire,https://static.ankama.com/wakfu/portal/game/spell/6261.png
5f04a9cd2b523147dc2fe14c,ouginak,Molosse,5,0,0,false,"L’Ouginak tire profit de sa Rage, et gagne une Armure d’une efficacité proportionnelle à celle-ci.",élementaire,https://static.ankama.com/wakfu/portal/game/spell/6265.png
5f04a9d02b523147dc2fe14d,ouginak,Balayage,4,0,0,1 - 3,"Expert en maniement des armes, l’Ouginak lance ses dagues sur sa cible pour lui infliger de gros dégâts.",élementaire,https://static.ankama.com/wakfu/portal/game/spell/6266.png
5f04a9d22b523147dc2fe14e,ouginak,Contusion,3,0,0,2 - 2,L’Ouginak bondit en l’air pour infliger des dégâts à l’arme blanche. Il peut également consommer une partie de sa Rage pour infliger plus de dommages.,élementaire,https://static.ankama.com/wakfu/portal/game/spell/6267.png
5f04a9d42b523147dc2fe14f,ouginak,Cador,3,0,true,1 - 3,L’Ouginak utilise son grappin pour blesser son ennemi ! Il en profite pour passer dans son dos.,élementaire,https://static.ankama.com/wakfu/portal/game/spell/6268.png
5f04a9d72b523147dc2fe150,ouginak,"Brise'Os",2,0,0,1 - 3,"Ce sort utilise les connaissances en anatomie de l’Ouginak pour briser l’Os de sa cible. Celle-ci est alors blessée, et utiliser des sorts à coût élevé pendant son tour lui fait perdre des points de vie supplémentaires, tout comme les déplacements.",élementaire,https://static.ankama.com/wakfu/portal/game/spell/6269.png
5f04a9d92b523147dc2fe151,ouginak,Baroud,6,0,0,1 - 3,"L’Ouginak applique son plus puissant poison sur son ennemi... Si la cible termine son tour au corps-à-corps de l'Ouginak, elle subit des dommages supplémentaires !",élementaire,https://static.ankama.com/wakfu/portal/game/spell/6270.png
5f04a9d92b523147dc2fe152,ouginak,Proie,6,0,0,1 - 3,"L’Ouginak applique son plus puissant poison sur son ennemi... Si la cible termine son tour au corps-à-corps de l'Ouginak, elle subit des dommages supplémentaires !",spécialité,https://static.ankama.com/wakfu/portal/game/spell/6283.png
5f04a9da2b523147dc2fe153,ouginak,Chienchien,0,0,true,1 - 2,"Permet à l'Ouginak d'invoquer un compagnon contrôlable qui possède d'autres sorts.",spécialité,https://static.ankama.com/wakfu/portal/game/spell/6286.png
5f04a9db2b523147dc2fe154,ouginak,Traque,2,0,0,2 - 4,"L'Ouginak peut se rapprocher de ses adversaires mais peut aussi attirer ses alliés grâce à ses capacités de Chasseur.",spécialité,https://static.ankama.com/wakfu/portal/game/spell/6856.png
5f04a9db2b523147dc2fe155,ouginak,Canine,2,0,0,2 - 4,"L'Ouginak peut se rapprocher de ses adversaires mais peut aussi attirer ses alliés grâce à ses capacités de Chasseur.",spécialité,https://static.ankama.com/wakfu/portal/game/spell/6287.png
5f04a9db2b523147dc2fe156,ouginak,Apaisement,3,0,0,2 - 3,"L'Ouginak pose un glyphe qui inflige des dommages et immobilise les cibles qui débutent leur tour dedans.",spécialité,https://static.ankama.com/wakfu/portal/game/spell/6288.png
5f04a9db2b523147dc2fe157,ouginak,Terrier,3,0,0,2 - 3,"L'Ouginak pose un glyphe qui inflige des dommages et immobilise les cibles qui débutent leur tour dedans.",spécialité,https://static.ankama.com/wakfu/portal/game/spell/6271.png
5f04a9db2b523147dc2fe158,ouginak,Epuisement,0,0,0,false,"Au fil du temps, l'Ouginak est devenu un chasseur hors pair. Il attend le bon moment pour passer à l'action et profite de ses sorts actifs servant à contrôler ses adversaires.",spécialité,https://static.ankama.com/wakfu/portal/game/spell/6276.png
5f04a9dc2b523147dc2fe159,ouginak,Flair,0,0,0,false,"Au fil du temps, l'Ouginak est devenu un chasseur hors pair. Il attend le bon moment pour passer à l'action et profite de ses sorts actifs servant à contrôler ses adversaires.",spécialité,https://static.ankama.com/wakfu/portal/game/spell/6279.png
5f04a9dc2b523147dc2fe15a,ouginak,Maître Chien,0,0,0,false,"L'Ouginak profite de son flair légendaire pour repérer ses cibles à distance. Il peut alors les attaquer de loin avant de s'en approcher pour porter le coup fatal.",spécialité,https://static.ankama.com/wakfu/portal/game/spell/6273.png
5f04a9dc2b523147dc2fe15b,ouginak,Pillage,0,0,0,false,"L'Ouginak profite de son flair légendaire pour repérer ses cibles à distance. Il peut alors les attaquer de loin avant de s'en approcher pour porter le coup fatal.",spécialité,https://static.ankama.com/wakfu/portal/game/spell/6277.png
5f04a9dc2b523147dc2fe15c,ouginak,Ardeur,0,0,0,false,"Les sens aiguisés de l’Ouginak lui permettent de survivre à presque toutes les situations. Capable de s’adapter et de développer de nouveaux moyens de défense, il fortifie ses gains d’Armure et se donne une quantité d'Armure en fonction du nombre d'ennemis à son contact.",spécialité,https://static.ankama.com/wakfu/portal/game/spell/6275.png
5f04a9dc2b523147dc2fe15d,ouginak,Art Canin,0,0,0,false,"Les sens aiguisés de l’Ouginak lui permettent de survivre à presque toutes les situations. Capable de s’adapter et de développer de nouveaux moyens de défense, il fortifie ses gains d’Armure et se donne une quantité d'Armure en fonction du nombre d'ennemis à son contact.",spécialité,https://static.ankama.com/wakfu/portal/game/spell/6272.png
5f04ac283b67476be7c8f2dc,ouginak,Compagnon,0,0,0,false,"L'Ouginak tient à son territoire. En bon chasseur, il sait que connaître et contrôler le terrain en sa faveur est un des moyens les plus efficaces pour capturer sa Proie.",spécialité,https://static.ankama.com/wakfu/portal/game/spell/6274.png
5f04ac283b67476be7c8f2dd,ouginak,Crocs Futés,0,0,0,false,"L'Ouginak tient à son territoire. En bon chasseur, il sait que connaître et contrôler le terrain en sa faveur est un des moyens les plus efficaces pour capturer sa Proie.",spécialité,https://static.ankama.com/wakfu/portal/game/spell/6278.png
5f04ac293b67476be7c8f2de,ouginak,Marchandage,0,0,0,false,"L’Ouginak est un chasseur confirmé et expérimenté. Il sait que lors d’une traque, il faut toujours surveiller ses arrières, car tous les prédateurs peuvent se retrouver dans la position de la proie d’un instant à l’autre.",spécialité,https://static.ankama.com/wakfu/portal/game/spell/6280.png
5f04ac303b67476be7c8f2df,steamer,Courant,2,0,0,1 - 3,Inflige des dommages Eau et inflige un malus à sa cible. Le type du malus dépend de la distance entre le lanceur et sa cible.,élementaire,https://static.ankama.com/wakfu/portal/game/spell/923.png
5f04ac313b67476be7c8f2e0,steamer,Feu Ardent,2,0,0,2 - 4,"Inflige des dommages Feu en zone. Cette attaque à distance est souple d'utilisation.",élementaire,https://static.ankama.com/wakfu/portal/game/spell/2833.png
5f04ac333b67476be7c8f2e1,steamer,Crache Flammes,4,0,0,2 - 3,"Inflige des dommages feu en zone, avec une contrainte de lancer en ligne.",élementaire,https://static.ankama.com/wakfu/portal/game/spell/2832.png
5f04ac353b67476be7c8f2e2,steamer,Calcination,4,0,0,3 - 6,Inflige des dommages Feu. Le Steamer perd des PV.,élementaire,https://static.ankama.com/wakfu/portal/game/spell/2835.png
