_id,classe,spell,pa,pm,wakfu,po,text,spell_type,sprite
5f04a74f8057fe8bd9ca3bbe,sadida,Rouille,4,0,0,2 - 4,"Si le sort est ciblé sur un adversaire, le sort fait des dégâts dans toute la zone. Sinon, si le sort est ciblé sur un allié ou sur une case vide, le sort fait un soin dans toute la zone. Puissant mais à bien utiliser !",élementaire,https://static.ankama.com/wakfu/portal/game/spell/931.png
5f04a7518057fe8bd9ca3bbf,sadida,Drainage,5,0,0,1 - 4,Le Sadida draine les Points de Vie d’une cible et les transfère aux cibles proches.,élementaire,https://static.ankama.com/wakfu/portal/game/spell/922.png
5f04a7538057fe8bd9ca3bc0,sadida,Ronce,3,0,0,1 - 4,Un sort qui inflige des dégâts Terre en fouettant à vif les adversaires un peu trop téméraires ou crée un bouclier de ronces sur un allié.,élementaire,https://static.ankama.com/wakfu/portal/game/spell/925.png
5f04a7558057fe8bd9ca3bc1,sadida,Engrais,4,0,0,1 - 3,Un sort de Terre simple qui inflige des dégâts à la cible et lui vole un PM ou crée un bouclier de ronces sur un allié.,élementaire,https://static.ankama.com/wakfu/portal/game/spell/929.png
5f04a75a8057fe8bd9ca3bc2,sadida,Herbes Folles,2,0,0,1 - 6,Herbes Folles invoque des plantes sauvages qui infligent des dégâts de Terre et réduisent le mouvement de leurs cibles.,élementaire,https://static.ankama.com/wakfu/portal/game/spell/927.png
5f04a75c8057fe8bd9ca3bc3,sadida,Tremblement de Terre,3,0,0,false,"En invoquant les forces de la nature, le Sadida provoque un tremblement de terre qui sévit autour de lui et de chacune de ses poupées.",élementaire,https://static.ankama.com/wakfu/portal/game/spell/935.png
5f04a75e8057fe8bd9ca3bc4,sadida,Ronces Multiples,5,0,true,2 - 5,Ce sort de zone ajoute du piquant à vos combats : il est contraignant mais peut toucher de nombreux adversaires et inflige de lourds dégâts.,élementaire,https://static.ankama.com/wakfu/portal/game/spell/937.png
5f04a7628057fe8bd9ca3bc5,sadida,Relent Boisé,3,0,0,1 - 4,"Le Sadida pousse un souffle peu puissant, capable d’intoxiquer l’adversaire.",élementaire,https://static.ankama.com/wakfu/portal/game/spell/932.png
5f04a7658057fe8bd9ca3bc6,sadida,Vent Empoisonné,2,0,0,3 - 4,Le Sadida invoque un puissant vent empoisonné affectant toutes les cibles dans une zone autour de la case ciblée.,élementaire,https://static.ankama.com/wakfu/portal/game/spell/919.png
5f04a7668057fe8bd9ca3bc7,sadida,Coup de Froid,4,0,0,2 - 3,Ce sort permet de baisser les résistances tout en infligeant des dégâts.,élementaire,https://static.ankama.com/wakfu/portal/game/spell/928.png
5f04a7698057fe8bd9ca3bc8,sadida,Kohmir,3,0,0,1 - 3,Kohmir permet au Sadida de tirer une cible durant un tour.,élementaire,https://static.ankama.com/wakfu/portal/game/spell/934.png
5f04a76b8057fe8bd9ca3bc9,sadida,Bourrasque,2,0,0,2 - 4,"Bourrasque permet d'invoquer un vent violent, qui inflige des dégâts à la cible et repousse autour de celle-ci.",élementaire,https://static.ankama.com/wakfu/portal/game/spell/938.png
5f04a76b8057fe8bd9ca3bca,sadida,La Surpuissante,2,0,0,2 - 4,"Bourrasque permet d'invoquer un vent violent, qui inflige des dégâts à la cible et repousse autour de celle-ci.",spécialité,https://static.ankama.com/wakfu/portal/game/spell/911.png
5f04a76c8057fe8bd9ca3bcb,sadida,Sacrifice Poupesque,2,0,0,1 - 4,Le Sadida sacrifie une de ses poupées et récupère des PV en fonction de son niveau.,spécialité,https://static.ankama.com/wakfu/portal/game/spell/920.png
5f04a76d8057fe8bd9ca3bcc,sadida,Arbre,2,0,0,1 - 4,Le Sadida sacrifie une de ses poupées et récupère des PV en fonction de son niveau.,spécialité,https://static.ankama.com/wakfu/portal/game/spell/915.png
5f04a76d8057fe8bd9ca3bcd,sadida,La Voodoll,0,0,true,false,"Le Sadida se transforme en arbre pour un tour, il ne peut plus bouger, se soigne et augmente ses résistances.",spécialité,https://static.ankama.com/wakfu/portal/game/spell/926.png
5f04a76d8057fe8bd9ca3bce,sadida,Eveil Sylvestre,3,0,true,1 - 4,Le Sadida invoque une Voodoll qui va venir assister ses alliés sur le terrain.,spécialité,https://static.ankama.com/wakfu/portal/game/spell/2210.png
5f04a83ac4b9bd209a20cf54,sadida,Ordre des Chênaies,2,0,true,1 - 3,"Le Sadida transmet l'essence même de la forêt à un membre de son équipe, éveillant ses sens à la beauté de la nature. Ce processus est long et dangereux mais il permet de rendre la vie à un allié tombé au combat.",spécialité,https://static.ankama.com/wakfu/portal/game/spell/914.png
5f04a83ac4b9bd209a20cf55,sadida,Savoir Sadida,2,0,true,1 - 3,"Le Sadida transmet l'essence même de la forêt à un membre de son équipe, éveillant ses sens à la beauté de la nature. Ce processus est long et dangereux mais il permet de rendre la vie à un allié tombé au combat.",spécialité,https://static.ankama.com/wakfu/portal/game/spell/917.png
5f04a83ac4b9bd209a20cf56,sadida,Prière Sadida,0,0,0,false,"""Plus on est de fous, plus on tue !"" Ce sort permet au Sadida de contrôler plus de poupées en même temps et d'augmenter leur efficacité.",spécialité,https://static.ankama.com/wakfu/portal/game/spell/4959.png
5f04a83ac4b9bd209a20cf57,sadida,Lien Poupesque,0,0,0,false,"""Plus on est de fous, plus on tue !"" Ce sort permet au Sadida de contrôler plus de poupées en même temps et d'augmenter leur efficacité.",spécialité,https://static.ankama.com/wakfu/portal/game/spell/916.png
5f04a83ac4b9bd209a20cf58,sadida,Garde Feuille,0,0,0,false,"Dans une symbiose absolue, le Sadida lie sa vie à celle de ses poupées. Ensemble, ils gagnent en résistance.",spécialité,https://static.ankama.com/wakfu/portal/game/spell/913.png
5f04a83ac4b9bd209a20cf59,sadida,Exploupée,0,0,0,false,"Dans une symbiose absolue, le Sadida lie sa vie à celle de ses poupées. Ensemble, ils gagnent en résistance.",spécialité,https://static.ankama.com/wakfu/portal/game/spell/933.png
5f04a83bc4b9bd209a20cf5a,sadida,Toxine Inoffensive,0,0,0,false,"Lorsqu’une poupée meurt, une partie de son âme retourne au Sadida. Une manière pour la poupée de se dévouer à son Sadida jusqu’au bout.",spécialité,https://static.ankama.com/wakfu/portal/game/spell/5055.png
5f04a83bc4b9bd209a20cf5b,sadida,Sadida Solitaire,0,0,0,false,"Lorsqu’une poupée meurt, une partie de son âme retourne au Sadida. Une manière pour la poupée de se dévouer à son Sadida jusqu’au bout.",spécialité,https://static.ankama.com/wakfu/portal/game/spell/912.png
5f04a83bc4b9bd209a20cf5c,sadida,Murmures Sauvages,0,0,0,false,"Si le Sadida n'a pas de poupée sur le terrain, ses dégâts et ses soins sont augmentés.",spécialité,https://static.ankama.com/wakfu/portal/game/spell/5058.png
5f04a83bc4b9bd209a20cf5d,sadida,Venimeux,0,0,0,false,"Si le Sadida n'a pas de poupée sur le terrain, ses dégâts et ses soins sont augmentés.",spécialité,https://static.ankama.com/wakfu/portal/game/spell/5234.png
5f04a83bc4b9bd209a20cf5e,sadida,"Terrain d'entente",0,0,0,false,"Ce passif accroît les chances de retirer des PM et augmente les dégâts indirects réalisés. Dans le cas du Sadida, les dégâts indirects sont principalement des poisons.",spécialité,https://static.ankama.com/wakfu/portal/game/spell/7053.png
5f04a842c4b9bd209a20cf5f,sacrieur,Sang pour Sang,3,0,0,1 - 1,Une attaque qui inflige des dégâts très corrects mais qui blesse aussi le Sacrieur.,élementaire,https://static.ankama.com/wakfu/portal/game/spell/895.png
5f04a843c4b9bd209a20cf60,sacrieur,Furie Sanguinaire,2,0,0,0 - 6,"Le Sacrieur inflige à un allié, ou à lui-même, une partie de sa vie en dégâts pour augmenter les Dommages infligés au prochain sort. Furie Sanguinaire peut être très puissant en combinaison à Sacrifice pour se déplacer.",élementaire,https://static.ankama.com/wakfu/portal/game/spell/887.png
5f04a845c4b9bd209a20cf61,sacrieur,Sang Brûlant,4,0,0,false,Le Sacrieur brûle une partie de son Armure pour infliger de lourds dégâts Feu aux cibles autour de lui.,élementaire,https://static.ankama.com/wakfu/portal/game/spell/898.png
5f04a847c4b9bd209a20cf62,sacrieur,Cage de Sang,4,0,0,1 - 2,"Cage de Sang est l'outil idéal pour garder les fuyards à portée d'une punition bien méritée, mais également pour régénérer la vie du Sacrieur.",élementaire,https://static.ankama.com/wakfu/portal/game/spell/2104.png
5f04a848c4b9bd209a20cf63,sacrieur,Punition,6,0,true,1 - 1,"Punition est le sort de dégâts ultime du Sacrieur dont l'attaque devient dévastatrice lorsqu'il a 100 de Chrage. Le coût du sort est réduit de 1 PA par sort de placement lancé dans le tour.",élementaire,https://static.ankama.com/wakfu/portal/game/spell/900.png
5f04a84ac4b9bd209a20cf64,sacrieur,Pied Rocheux,3,0,0,1 - 3,"Le Sacrieur assène un coup de pied subtilement placé à son adversaire et en profite pour générer de l'Armure. Ce sort est aussi utilisable à distance, le Sacrieur manie les rochers comme un Cra manie son arc !",élementaire,https://static.ankama.com/wakfu/portal/game/spell/889.png
5f04a84bc4b9bd209a20cf65,sacrieur,Poing Tatoué Agrippant,2,0,0,1 - 3,"Les tatouages du Sacrieur s'agrippent solidement à la cible et le rapprochent de celle-ci pour la frapper.",élementaire,https://static.ankama.com/wakfu/portal/game/spell/5039.png
5f04a84cc4b9bd209a20cf66,sacrieur,Démence,4,0,0,false,"Le Sacrieur se déchaîne, attirant les cibles et leur infligeant des dégâts, en plus d'augmenter son Tacle.",élementaire,https://static.ankama.com/wakfu/portal/game/spell/5035.png
5f04a84ec4b9bd209a20cf67,sacrieur,Colonnades,5,0,0,false,"Le Sacrieur frappe de toutes ses forces sur le sol, faisant ressortir des colonnes autour de lui. Il inflige des dégâts et génère de l'Armure par adversaire touché.",élementaire,https://static.ankama.com/wakfu/portal/game/spell/2116.png
5f04a850c4b9bd209a20cf68,sacrieur,Fracasse,4,0,true,1 - 1,Le Sacrieur concentre sa force pour infliger une attaque salvatrice et se créer une Armure puissante.,élementaire,https://static.ankama.com/wakfu/portal/game/spell/892.png
5f04a852c4b9bd209a20cf69,sacrieur,Tattoo Ondoyant,4,0,0,1 - 2,"Le Sacrieur fouette un adversaire avec la force de ses tatouages, lui infligeant des dégâts, qui sont augmentés si la cible souffre de Mal des Transports.",élementaire,https://static.ankama.com/wakfu/portal/game/spell/2099.png
5f04a855c4b9bd209a20cf6a,sacrieur,Cinétose,2,0,0,0 - 4,"Cinétose peut se lancer sur un adversaire pour lui donner le Mal des Transports ou sur le Sacrieur pour transmettre le mal à toutes les cibles qu'il déplace. Lorsque le Sacrieur déplace une cible souffrant de Mal des Transports, il inflige des dégâts à toutes les cibles qui en souffrent aussi.",élementaire,https://static.ankama.com/wakfu/portal/game/spell/2100.png
5f04a858c4b9bd209a20cf6b,sacrieur,Assaut,3,0,0,1 - 5,"Assaut permet au Sacrieur d'échanger sa place avec celle de sa cible tout en lui infligeant quelques dégâts au passage.",élementaire,https://static.ankama.com/wakfu/portal/game/spell/847.png
5f04a859c4b9bd209a20cf6c,sacrieur,Tempête Spirituelle,4,0,0,0 - 3,Le Sacrieur déclenche une petite tempête. Les cibles échangent de position parallèlement par rapport au cœur de la tempête et les adversaires subissent des dégâts.,élementaire,https://static.ankama.com/wakfu/portal/game/spell/5034.png
5f04a85bc4b9bd209a20cf6d,sacrieur,Fulgurance,6,0,true,0 - 3,"Le Sacrieur inflige des dégâts dans une grande zone, utilisant sa dextérité pour frapper violemment toutes les cibles sur son passage, et réapparaît de l'autre côté de ses adversaires. S'il est sous Cinétose, Fulgurance coûte moins de PA à lancer.",élementaire,https://static.ankama.com/wakfu/portal/game/spell/2101.png
5f04a85bc4b9bd209a20cf6e,sacrieur,Attirance,6,0,true,0 - 3,"Le Sacrieur inflige des dégâts dans une grande zone, utilisant sa dextérité pour frapper violemment toutes les cibles sur son passage, et réapparaît de l'autre côté de ses adversaires. S'il est sous Cinétose, Fulgurance coûte moins de PA à lancer.",spécialité,https://static.ankama.com/wakfu/portal/game/spell/844.png
5f04a85cc4b9bd209a20cf6f,sacrieur,Sacrifice,0,0,true,0 - 4,"Le Sacrieur se sacrifie pour prendre les coups à la place de ses alliés. À chaque fois qu'un allié subit un sort infligeant des dégâts, le Sacrieur subit les dégâts puis échange de place avec l'allié.",spécialité,https://static.ankama.com/wakfu/portal/game/spell/878.png
5f04a85cc4b9bd209a20cf70,sacrieur,Transposition,0,0,true,0 - 4,"Le Sacrieur se sacrifie pour prendre les coups à la place de ses alliés. À chaque fois qu'un allié subit un sort infligeant des dégâts, le Sacrieur subit les dégâts puis échange de place avec l'allié.",spécialité,https://static.ankama.com/wakfu/portal/game/spell/888.png
5f04a85dc4b9bd209a20cf71,sacrieur,Armure Sanguine,3,0,0,1 - 6,"Le Sacrieur aime être au bon endroit au bon moment : en utilisant Transposition, il peut échanger sa place avec un allié ou ennemi.",spécialité,https://static.ankama.com/wakfu/portal/game/spell/2117.png
5f04a85dc4b9bd209a20cf72,sacrieur,Châtiment Osé,3,0,0,1 - 6,"Le Sacrieur aime être au bon endroit au bon moment : en utilisant Transposition, il peut échanger sa place avec un allié ou ennemi.",spécialité,https://static.ankama.com/wakfu/portal/game/spell/879.png
5f04a85dc4b9bd209a20cf73,sacrieur,Châtiment Sanguin,0,0,true,false,"Il faut avoir de l'audace pour jouer le Châtiment Osé : il est possible d'y gagner beaucoup de dégâts mais aussi d'y perdre la vie ! Seul un Châtiment peut être actif à la fois.",spécialité,https://static.ankama.com/wakfu/portal/game/spell/6065.png
5f04a85dc4b9bd209a20cf74,sacrieur,Enchragé,0,0,true,false,"Il faut avoir de l'audace pour jouer le Châtiment Osé : il est possible d'y gagner beaucoup de dégâts mais aussi d'y perdre la vie ! Seul un Châtiment peut être actif à la fois.",spécialité,https://static.ankama.com/wakfu/portal/game/spell/2107.png
5f04a85dc4b9bd209a20cf75,sacrieur,Sang Tatoué ,0,0,0,false,"Véritable guerrier sanguinaire, plus le Sacrieur est blessé et plus sa rage du combat augmente, le rendant plus dangereux.",spécialité,https://static.ankama.com/wakfu/portal/game/spell/5051.png
5f04a85dc4b9bd209a20cf76,sacrieur,Transcendance,0,0,0,false,"Véritable guerrier sanguinaire, plus le Sacrieur est blessé et plus sa rage du combat augmente, le rendant plus dangereux.",spécialité,https://static.ankama.com/wakfu/portal/game/spell/5194.png
5f04a85ec4b9bd209a20cf77,sacrieur,Mobilité,0,0,0,false,"La Transcendance est le symbole de la rapidité de réaction et de vivacité du Sacrieur. Elle lui permet de régéner ses points de Wakfu plus rapidement, et d'être plus polyvalent.",spécialité,https://static.ankama.com/wakfu/portal/game/spell/5192.png
5f04a85ec4b9bd209a20cf78,sacrieur,Pacte de Sang,0,0,0,false,"La Transcendance est le symbole de la rapidité de réaction et de vivacité du Sacrieur. Elle lui permet de régéner ses points de Wakfu plus rapidement, et d'être plus polyvalent.",spécialité,https://static.ankama.com/wakfu/portal/game/spell/877.png
5f04a85ec4b9bd209a20cf79,sacrieur,Le Cœur de Sacrieur,0,0,0,false,"La déesse Sacrieur confie de nouvelles capacités au Sacrieur, augmentant ses capacités de survie et de protection d'alliés, tout en améliorant la puissance de Furie Sanguinaire.",spécialité,https://static.ankama.com/wakfu/portal/game/spell/5193.png
5f04a85ec4b9bd209a20cf7a,sacrieur,Transporteur,0,0,0,false,"La déesse Sacrieur confie de nouvelles capacités au Sacrieur, augmentant ses capacités de survie et de protection d'alliés, tout en améliorant la puissance de Furie Sanguinaire.",spécialité,https://static.ankama.com/wakfu/portal/game/spell/5054.png
5f04a85ec4b9bd209a20cf7b,sacrieur,Armure Brûlante,0,0,0,false,"Ce passif vous permet d'imiter Jazon Statanne, le célèbre Sacrieur, qui, passé maître dans l'art de déplacer ses adversaires, leur donnait le tournis et s'en servait à leurs dépens.",spécialité,https://static.ankama.com/wakfu/portal/game/spell/5049.png
5f04a85ec4b9bd209a20cf7c,sacrieur,Fracasseur,0,0,0,false,"Ce passif vous permet d'imiter Jazon Statanne, le célèbre Sacrieur, qui, passé maître dans l'art de déplacer ses adversaires, leur donnait le tournis et s'en servait à leurs dépens.",spécialité,https://static.ankama.com/wakfu/portal/game/spell/5195.png
5f04a85fc4b9bd209a20cf7d,sacrieur,Refus de la Mort,0,0,0,false,"Faisant fit du danger tel un fou furieux sanguinaire, plus le Sacrieur est blessé, plus il est violent !",spécialité,https://static.ankama.com/wakfu/portal/game/spell/845.png
5f04a866c4b9bd209a20cf7e,pandawa,Souffle Laiteux,2,0,0,1 - 3,"Le Pandawa souffle sur sa cible et lui inflige des dégâts d’Eau bien sentis. De plus, ce souffle imbibe la cible ! Si le Pandawa lance un allié avec ce sort, l'allié est soigné.",élementaire,https://static.ankama.com/wakfu/portal/game/spell/944.png
5f04a86bc4b9bd209a20cf7f,pandawa,Souffle Enflammé,2,0,0,1 - 3,Le Pandawa souffle vers ses adversaires et leur inflige des dégâts de Feu ! De plus il leur retire des résistances si elles sont <b>Imbibées</b> !,élementaire,https://static.ankama.com/wakfu/portal/game/spell/2194.png
5f04a86fc4b9bd209a20cf80,pandawa,Tournée Générale,3,0,0,1 - 4,"Tournée Générale permet au Pandawa d'infliger généreusement des dégâts Feu tout en s'enflammant. Lancés sur le Tonneau, celui-ci est détruit mais applique une grande quantité d'Imbibé autour de lui.",élementaire,https://static.ankama.com/wakfu/portal/game/spell/2199.png
5f04a875c4b9bd209a20cf81,pandawa,Coup Laiteux,2,0,0,2 - 2,"Le Pandawa echaude ses cibles, effectue un saut et occasionne des dégâts autour de sa case d'arrivée.",élementaire,https://static.ankama.com/wakfu/portal/game/spell/2196.png
5f04a87ac4b9bd209a20cf82,pandawa,Flasque Explosive,4,0,0,2 - 4,Le Pandawa lance une flasque remplie de Lait de Bambou qui explose sur ses adversaires.,élementaire,https://static.ankama.com/wakfu/portal/game/spell/2200.png
5f04a87ec4b9bd209a20cf83,pandawa,Toilaitage,5,0,0,3 - 4,"Amateur de dégâts collatéraux, Toilaitage permet au Pandawa de nettoyer une grande zone. Si son Tonneau est dans la zone, il inflige plus de dommages.",élementaire,https://static.ankama.com/wakfu/portal/game/spell/2256.png
5f04a881c4b9bd209a20cf84,pandawa,Nuage Laiteux,4,0,0,1 - 5,"Le Pandawa crée un Nuage Laiteux qui inflige des dégâts et imbibe les cibles ! Lancé sur le Tonneau, cela crée un Nuage de Lait qui soigne toutes les cibles présentes en début de tour.",élementaire,https://static.ankama.com/wakfu/portal/game/spell/2203.png
5f04a883c4b9bd209a20cf85,pandawa,Tekilait,3,0,0,0 - 4,"Tekilait réalise un soin sur sa cible. Il permet également, si le Pandawa est aligné avec sa cible, de le pousser de deux cases.",élementaire,https://static.ankama.com/wakfu/portal/game/spell/2204.png
5f04a887c4b9bd209a20cf86,pandawa,Vague de Lait,6,0,true,2 - 6,"Créant une Vague de Lait, le Pandawa consomme l'Imbibé de son allié pour le soigner. Il peut aussi s'en servir pour faire des dégâts à un adversaire. Lancé sur le Tonneau, les dégâts passent en zone.",élementaire,https://static.ankama.com/wakfu/portal/game/spell/2205.png
5f04a88bc4b9bd209a20cf87,pandawa,Fontaine de Laiqueur,5,true,0,1 - 5,"Partageur, le Pandawa paie sa tournée, tout en blessant ses ennemis : si le sort est lancé sur le Tonneau, toutes les cibles seront irrésistiblement attirées vers lui !",élementaire,https://static.ankama.com/wakfu/portal/game/spell/2207.png
5f04a88fc4b9bd209a20cf88,pandawa,Triple Karma Leet,2,0,0,1 - 1,"Le Pandawa inflige des dégâts tout en repoussant son adversaire. S'il porte son Tonneau, il attirera son adversaire au lieu de le repousser !",élementaire,https://static.ankama.com/wakfu/portal/game/spell/2190.png
5f04a895c4b9bd209a20cf89,pandawa,Six Roses,4,0,0,1 - 1,"Six Roses inflige de gros dégâts Terre, imbibe la cible et enflamme le Pandawa ! Si le Pandawa porte son Tonneau, il s'applique une Armure en fonction du niveau d'Imbibé de sa cible.",élementaire,https://static.ankama.com/wakfu/portal/game/spell/2193.png
5f04a89bc4b9bd209a20cf8a,pandawa,Frappe Fût,2,0,0,false,"Le Pandawa inflige des dégâts et imbibe les cibles autour de lui, en plus de les Echauder ! Si le Pandawa porte son Tonneau, il augmente son Tacle en fonction du niveau d'Imbibé de ses cibles.",élementaire,https://static.ankama.com/wakfu/portal/game/spell/2197.png
5f04a89fc4b9bd209a20cf8b,pandawa,"Lucha L'ambrée",4,0,0,1 - 2,"Le Pandawa utilise son Tonneau pour faire des dégâts à distance et imbiber les cibles ! Si le Pandawa porte un personnage, il le lance en infligeant des dégâts et en retirant des PM dans la zone.",élementaire,https://static.ankama.com/wakfu/portal/game/spell/2198.png
5f04a8a4c4b9bd209a20cf8c,pandawa,Blitzkriek,6,0,true,2 - 4,"Le Pandawa inflige des dégâts, imbibe et échaude ses cibles, et se téléporte à la position ciblée s'il portait son Tonneau.",élementaire,https://static.ankama.com/wakfu/portal/game/spell/2201.png
5f04a8a5c4b9bd209a20cf8d,pandawa,Tonneau,6,0,true,2 - 4,"Le Pandawa inflige des dégâts, imbibe et échaude ses cibles, et se téléporte à la position ciblée s'il portait son Tonneau.",spécialité,https://static.ankama.com/wakfu/portal/game/spell/2192.png
5f04a8a7c4b9bd209a20cf8e,pandawa,Soif,true,0,0,1 - 2,"Si le Pandawa porte son tonneau, il peut utiliser ce sort peu coûteux pour échanger de position avec un allié à proximité.",spécialité,https://static.ankama.com/wakfu/portal/game/spell/664.png
5f04a8a7c4b9bd209a20cf8f,pandawa,Ebriété,true,0,0,1 - 2,"Si le Pandawa porte son tonneau, il peut utiliser ce sort peu coûteux pour échanger de position avec un allié à proximité.",spécialité,https://static.ankama.com/wakfu/portal/game/spell/949.png
5f04a8a7c4b9bd209a20cf90,pandawa,Happy Hour,0,0,true,0 - 4,"Ebriété permet de s'appliquer Ivresse ou de l'entretenir, pratique lorsqu'il n'y a pas de tonneau à proximité ! Ce sort applique 5 niveaux d'imbibé s'il est lancé sur une autre cible que le Pandawa lui-même.",spécialité,https://static.ankama.com/wakfu/portal/game/spell/978.png
5f04a8a7c4b9bd209a20cf91,pandawa,Ether,0,0,true,0 - 4,"Ebriété permet de s'appliquer Ivresse ou de l'entretenir, pratique lorsqu'il n'y a pas de tonneau à proximité ! Ce sort applique 5 niveaux d'imbibé s'il est lancé sur une autre cible que le Pandawa lui-même.",spécialité,https://static.ankama.com/wakfu/portal/game/spell/2208.png
5f04a8a7c4b9bd209a20cf92,pandawa,Téléportono,2,0,true,0 - 4,"La cible d'Ether devient stabilisée. Si la cible est un allié, celui-ci gagne des PM et devient intaclable. Si la cible est un adversaire, celui-ci ne peut plus tacler.",spécialité,https://static.ankama.com/wakfu/portal/game/spell/2209.png
5f04a8a8c4b9bd209a20cf93,pandawa,Cocktail,2,0,true,0 - 4,"La cible d'Ether devient stabilisée. Si la cible est un allié, celui-ci gagne des PM et devient intaclable. Si la cible est un adversaire, celui-ci ne peut plus tacler.",spécialité,https://static.ankama.com/wakfu/portal/game/spell/782.png
5f04a9542b523147dc2fe0ff,pandawa,"Maître de l'Ivresse",0,0,0,false,"Sa maîtrise dans la confection de Cocktails permet au Pandawa d'améliorer ses soins en contre-partie de ses dégâts.
Les sorts Souffle Enflammé et Tekilait soignent désormais les alliés.",spécialité,https://static.ankama.com/wakfu/portal/game/spell/2212.png
5f04a9542b523147dc2fe100,pandawa,Tonneau sans Fond,0,0,0,false,"Sa maîtrise dans la confection de Cocktails permet au Pandawa d'améliorer ses soins en contre-partie de ses dégâts.
Les sorts Souffle Enflammé et Tekilait soignent désormais les alliés.",spécialité,https://static.ankama.com/wakfu/portal/game/spell/2213.png
5f04a9552b523147dc2fe101,pandawa,Tonneau Agressif,0,0,0,false,"Tonneau sans Fond augmente la contenance du Tonneau. Instinctivement, le Pandawa porte son Tonneau en fin de tour et se soigne en buvant quelques litres.",spécialité,https://static.ankama.com/wakfu/portal/game/spell/2214.png
5f04a9552b523147dc2fe102,pandawa,Instinct Laiteux,0,0,0,false,"Tonneau sans Fond augmente la contenance du Tonneau. Instinctivement, le Pandawa porte son Tonneau en fin de tour et se soigne en buvant quelques litres.",spécialité,https://static.ankama.com/wakfu/portal/game/spell/2211.png
5f04a9552b523147dc2fe103,pandawa,Bambouteille,0,0,0,false,"Chaque fois qu'il consomme de l'Imbibé sur sa cible, le Pandawa gagne des dégâts pour son prochain sort. De plus, ce passif permet d'imbiber les cibles autour du Tonneau à chaque début de tour du Pandawa.",spécialité,https://static.ankama.com/wakfu/portal/game/spell/5148.png
5f04a9552b523147dc2fe104,pandawa,Cyanose,0,0,0,false,"Chaque fois qu'il consomme de l'Imbibé sur sa cible, le Pandawa gagne des dégâts pour son prochain sort. De plus, ce passif permet d'imbiber les cibles autour du Tonneau à chaque début de tour du Pandawa.",spécialité,https://static.ankama.com/wakfu/portal/game/spell/5149.png
5f04a9562b523147dc2fe105,pandawa,Buvette,0,0,0,false,"Grâce à ses connaissances sur les laits de Bambou, le Pandawa peut empoisonner ses ennemis à l'aide d'une recette ancestrale dont seuls les vrais Pandawas ont le secret. En prenant de tels risques, le Pandawa perd la faculté à soigner efficacement ses alliés.",spécialité,https://static.ankama.com/wakfu/portal/game/spell/5150.png
5f04a9562b523147dc2fe106,pandawa,Pandémie,0,0,0,false,"Grâce à ses connaissances sur les laits de Bambou, le Pandawa peut empoisonner ses ennemis à l'aide d'une recette ancestrale dont seuls les vrais Pandawas ont le secret. En prenant de tels risques, le Pandawa perd la faculté à soigner efficacement ses alliés.",spécialité,https://static.ankama.com/wakfu/portal/game/spell/5151.png
